{
  "$schema": "https://niklasrosenstein.github.io/gitopsctr/schemas/apis/unit.gitopsctr.io/v1/ViteOciBundle/authored.schema.json",
  "apiVersion": "unit.gitopsctr.io/v1",
  "kind": "ViteOciBundle",
  "metadata": {
    "name": "frontend-bundle"
  },
  "spec": {
    "build": {
      "nodeVersion": "24"
    },
    "publish": {
      "repository": "registry.example/example/frontend"
    },
    "source": {
      "inputs": [
        "."
      ],
      "path": "web"
    }
  }
}
